{
  "$schema": "../schema.json",
  "name": "Clinical SOAP Notes & Medical Terms",
  "author": "alexgutscher26",
  "version": "1.0.0",
  "category": "Healthcare",
  "description": "HIPAA-compliant phonetic biasing for healthcare providers: clinical abbreviations, pharmacology terms, and SOAP note templates.",
  "vocabulary": [
    { "term": "lisinopril", "phonetic": "lye sin oh pril", "bias_weight": 1.4 },
    { "term": "metformin", "phonetic": "met for min", "bias_weight": 1.4 },
    { "term": "atorvastatin", "phonetic": "uh tor vuh stat in", "bias_weight": 1.4 },
    { "term": "amlodipine", "phonetic": "am loh dih peen", "bias_weight": 1.4 },
    { "term": "hydrochlorothiazide", "phonetic": "hye droh klor oh thye uh zide", "bias_weight": 1.5 },
    { "term": "erythema", "phonetic": "air uh thee muh", "bias_weight": 1.3 },
    { "term": "dyspnea", "phonetic": "disp nee uh", "bias_weight": 1.4 },
    { "term": "tachycardia", "phonetic": "tack ih car dee uh", "bias_weight": 1.3 },
    { "term": "auscultation", "phonetic": "aw skul tay shun", "bias_weight": 1.4 }
  ],
  "abbreviations": {
    "prn": "p.r.n.",
    "bid": "b.i.d.",
    "tid": "t.i.d.",
    "po": "p.o.",
    "hpi": "HPI",
    "soap": "SOAP"
  },
  "voice_snippets": {
    "insert soap note template": "### CLINICAL PROGRESS NOTE\n**Subjective (S):** \n**Objective (O):** \n- Vitals: BP: , HR: , RR: , Temp: \n- Exam: \n**Assessment (A):** \n**Plan (P):** \n- Medications: \n- Follow-up: ",
    "insert vitals template": "Vitals: BP 120/80 mmHg | Pulse 72 bpm | SpO2 98% on room air | Temp 98.6 F"
  },
  "system_prompt_addon": "Ensure precise medical terminology, drug dosages with proper units (mg, mL, mcg), and strict formatting for clinical documentation."
}
